{
  "objectClassName": "entity",
  "handle": "292",
  "roles": [
    "registrar"
  ],
  "publicIds": [
    {
      "type": "IANA Registrar ID",
      "identifier": "292"
    }
  ],
  "vcardArray": [
    "vcard",
    [
      [
        "version",
        {},
        "text",
        "4.0"
      ],
      [
        "fn",
        {},
        "text",
        "Example Inc."
      ],
      [
        "adr",
        {},
        "text",
        [
          "",
          "Suite 1234",
          "4321 Rue Somewhere",
          "Quebec",
          "QC",
          "G1V 2M2",
          "Canada"
        ]
      ],
      [
        "tel",
        {
          "type": "voice"
        },
        "uri",
        "tel:+1.9999999999"
      ],
      [
        "email",
        {},
        "text",
        "registrar@example.com"
      ]
    ]
  ],
  "entities": [
    {
      "objectClassName": "entity",
      "roles": [
        "abuse"
      ],
      "handle": "292",
      "vcardArray": [
        "vcard",
        [
          [
            "version",
            {},
            "text",
            "4.0"
          ],
          [
            "fn",
            {},
            "text",
            ""
          ],
          [
            "tel",
            {
              "type": "voice"
            },
            "uri",
            "tel:+1.9999999999"
          ],
          [
            "email",
            {},
            "text",
            "abusecomplaints@example.com"
          ]
        ]
      ]
    }
  ],
  "notices": [
    {
      "title": "Terms of Use",
      "description": [
        "Service subject to Terms of Use."
      ],
      "links": [
        {
          "href": "https://www.example.com/domain-names/registration-data-access-protocol/terms-service/index.xhtml",
          "value": "https://www.example.com/domain-names/registration-data-access-protocol/terms-service/index.xhtml",
          "rel": "self",
          "type": "text/html"
        }
      ]
    },
    {
      "title": "Status Codes",
      "description": [
        "For more information on domain status codes, please visit https://icann.org/epp"
      ],
      "links": [
        {
          "href": "https://icann.org/epp",
          "value": "https://icann.org/epp",
          "rel": "self",
          "type": "text/html"
        }
      ]
    },
    {
      "title": "RDDS Inaccuracy Complaint Form",
      "description": [
        "URL of the ICANN RDDS Inaccuracy Complaint Form: https://icann.org/wicf"
      ],
      "links": [
        {
          "href": "https://icann.org/wicf",
          "value": "https://icann.org/wicf",
          "rel": "self",
          "type": "text/html"
        }
      ]
    }
  ]
}